id,dlcID,name,gender,bio,lore,image
20,Ukraine,Zarina Kassir,Female,"A plucky documentarian, able to use her street smarts to avoid detection and greatly assist other Survivors.<br><br>Her personal perks, <b>Off The Record</b>, <b>Red Herring</b> and <b>For the People</b>, help her remain hidden in the face of danger, create distractions, and quickly heal others by forgoing her own safety.","Growing up in a Lebanese household in Brooklyn, Zarina struggled with two unique cultural identities. She felt this cultural difference painted a target on her back. To avoid ridicule and bullies, she observed what popular kids liked and learned to project the image they preferred. At school, she would go by the name ""Karina,"" dye her hair lighter, and trash her “foreign” lunches.<br><br>At home, the news channel was always on. Urgent reports of injustice captivated Zarina, inspiring her to produce her own stories. When she was a teenager, she embraced her real name and roots and borrowed her father’s digital camera to interview members of her community in Bay Ridge. By posting her content online, she slowly built a loyal following. Each week, she picked a new issue and challenged people to speak their mind on camera.<br><br>When she heard a rumor that a fast-food restaurant owner was exploiting workers, she decided to go undercover and produce a hard-hitting film. She modified her look, faked an accent, and secured a waitress position at the restaurant. After three weeks of unpaid work, she was fired for demanding her paycheck. To retaliate, she posted clips of the restaurant owner’s abusive behavior and within hours the news had picked up her story, but somehow spun it to create sympathy for the restaurant owner.<br><br>Embittered by the experience, Zarina committed to become an independent producer and filmmaker. Her first feature film was for a competition at school inspired by an English class poem about Sacco and Vanzetti, two Italian migrants controversially executed for murder. Her film won first prize and launched her as an uncompromising documentary filmmaker.<br><br>Months later, her world turned upside down. A public video surveillance camera filmed her father carrying two coffees at a street corner a few blocks from home. A tall, hooded man stood behind him. The man shouted something at her father who took a step back, startled. Suddenly and unexpectedly, the man pushed him in the street as a car sped by.<br><br>His death sent a shockwave of anger and pain that left Zarina in pieces.<br><br>The perpetrator—Clark Stevenson—was soon arrested and incarcerated for manslaughter.<br><br>Zarina became obsessed with Clark--his gang “IR-28”, his short prison sentence, his apparent lack of remorse. A year went by and she had uncovered enough about Clark to shed more light on his crime. With the last of her inheritance she bought a new camera and a plane ticket to Nebraska and bribed the warden at Hellshire Penitentiary to let her interview Clark.<br><br>She filmed their first meeting and asked him about her father and his gang and his violent tendencies. Clark refused to talk; but, in the weeks that followed, she used her research to push his buttons and finally got a confession of a pre-meditated crime.<br><br>Zarina’s film became a tribute to her father and the trail of blood left by gang violence. When the news finally picked up the story, it was because the film had gained international acclaim.<br><br>Some inmates contacted her when they heard about her documentary. Most of them shared eccentric anecdotes in hopes of being filmed, but one story stood out from the rest: an entire wing in Hellshire Penitentiary was sealed off because of the “Mad Mick Massacre.” The official story was an Irish outlaw had heartlessly slaughtered the warden and his guards.<br><br>From working on her Sacco and Vanzetti film, Zarina knew that the ‘official’ story wasn’t always the ‘true’ story. She investigated Hellshire’s records and found an Irish-American inmate sentenced to twenty years for assault in 1860. According to the penitentiary’s blueprint, the sealed off wing was part of Hellshire’s original infrastructure. If she reached that sealed off section, she could shed some light on the Mad Mick story. All she needed was a way in.<br><br>Next morning, she was joining the Hellshire Penitentiary walking tour. She blended in the crowd of jet-lagged tourists and veered off when they headed toward the kitchen. She’d memorized the blueprint and knew exactly where to go and how to avoid surveyance cameras. An unexpected security detail nearly cut her investigation short, but she was able to hide under an old, dusty prison bed. When the guards disappeared, she continued her search and finally found Mick’s cell.<br><br>Entering the dark, dilapidated cell, Zarina ran her hand across the old brick wall. Her fingers felt a marking and traced the letters: DEATH TO BAYSHORE. A loose brick fell, revealing a gap.<br><br>She inserted her hand. Fingers landed on a piece of cold, cracked metal. She fished it out… an old, rusty wrench. A damp chill ran down her spine and she looked down; a man lay at her feet, bleeding, his limbs contorted and his eyes, dark and terrified—her father’s eyes. A pool of crimson blood on black pavement. Paralyzed, black fog filled the cell and she shut her eyes to push these nightmarish visions out of her mind.",images/CharPortraits/Ukraine/US_charSelect_portrait.png
21,Wales,Cheryl Mason,Female,"Cheryl Mason is a young veteran of terror, emboldening both herself and her team.<br><br>Her personal perks, <b>Soul Guard</b>, <b>Blood Pact</b>, and <b>Repressed Alliance</b>, allow her to survive through immense hardship, stay in contact with team members, and plan objectives.","Caring and impulsive, Cheryl Mason, previously known as Heather, attempted to rebuild her life after the tragic death of her adoptive father, Harry Mason. While she had freed herself from the religious cult that pursued her since birth, she was shackled by the guilt of her father's death. A darkness&nbsp;punished her every night under the guise of abominable nightmares.<br><br>To ease her conscience, she volunteered at a crisis intervention center for troubled youth. Three months later, she aced training and could answer the crisis line without supervision. Yet little could have prepared her for the first call. All she heard was static. The air thickened as black fumes rose from the ground and&nbsp;suddenly&nbsp;she heard the voice of&nbsp;a woman—someone she thought she'd never hear from again.&nbsp;Why do you cling to this corrupt world? You know that only God can save us.<br><br>It couldn't be her—Claudia was dead.&nbsp;Suddenly, the world&nbsp;spun&nbsp;and she dropped on her knees, nauseous. Hot bile traveled up her throat and she retched warm blood on the floor. Then the spinning stopped as swiftly as it began. Cheryl looked up and saw she was somewhere else. A cold, hopeless place.",images/CharPortraits/Wales/S22_charSelect_portrait.png
22,Yemen,Felix Richter,Male,"A visionary architect, able to use his relentless determination to form a plan and help other Survivors.<br><br>His personal perks, <b>Visionary</b>, <b>Desperate Measures</b>, and <b>Built to Last</b>, help him reveal generators, rescue Survivors, and get the most from his tools.","Felix Richter was born to Janos and Ursula Richter in Coburg, Germany, where the Richter family had deep connections and were among the most respected of its physicians. His parents, both members of an ancient society, were always out of the Richter manor at medical conferences or providing humanitarian aid around the world. Travelling exposed young Felix to new cultures, languages, and architecture unlike anything he had ever seen before. He wasn’t sure when the architectural bug bit, but when it did, it bit hard, and he knew that despite his family’s legacy, he would one day design buildings that would inspire the world. By 23, he was considered an architectural prodigy having won the Swiss Architect Medal and the German National Design Award. Yet despite his success, Felix couldn’t shake the gnawing feeling that his success had more to do with luck and connections than talent and hard work.<br><br>Growing up, Felix was socially awkward and introverted, preferring his imagination to the company of others. He had few friends so when he wasn't traveling with his parents, Felix was in his father’s library devouring rare books, studying history and architecture, soaking up anything and everything he could on architectural movements throughout the centuries. His father hoped young Felix would learn to be more outgoing and hired every possible specialist to help improve his social skills. When these efforts failed, he threw in the proverbial towel and figured his son would learn when he was ready. He then joined young Felix in the library, where he helped him build elaborate wooden models of buildings while telling him wild stories about his secret club and their ancient battle against a dark and ominous force. Stories, Felix was sure, his father had made up to make his ‘Imperiatti’ group sound cooler than it actually was.<br><br>Felix sometimes wondered if his design sensibilities came from his summer trips to Dyer Island, a private island that boasted some of the world's finest homes and designs. Every summer, Felix would accompany his parents to the island, where members of The Imperiatti would encourage their children to network and forge lifelong connections. Felix didn’t mingle well with the other teenagers, but he did make four friends who like himself didn’t quite fit the ‘high-society’ mold. They were often ridiculed by other teens and disparagingly called ‘The Pariahs,' a name they liked and gladly adopted. Instead of practicing public speaking and engaging in endless debates, The Pariahs spent most of their time exploring the ruins and mysteries of the island until one of their adventures took a turn for the worse.<br><br>Exploring an abandoned internment camp, they descended into what seemed to be an underground laboratory where they uncovered old, leather journals with illustrations and notes of inhumane experiments conducted on prisoners of the First Opium War held by the British East India Company. As they pushed through a locked door, they found a chamber scattered with human skeletons and dusty vials filled with an unknown serum. Before they could examine the contents, the ground seemed to shake beneath their feet and a hissing sound filled their ears. A strange fog suddenly appeared and giant claws seemed to burst from the ground as dark imagination mingled with reality to terrorize them. Before they understood what was happening, Felix’s father and several other parents came to their rescue, using strange tools and objects to protect them. Felix stared at the scene in shock and disbelief. He wasn’t sure if he was dreaming or living one of his father’s ridiculous, supernatural stories. By the time he realized it wasn’t a dream, it was all over. The Pariahs were safe, but their parents had mysteriously disappeared without a trace.<br><br>After the shock of his father’s disappearance, Felix searched for any theory that could help him understand the phenomena he had encountered on the island. He exchanged notes with The Pariahs and other people he had met online who had also lost loved ones in a similar way. The tragedy had fostered a strong relationship between The Pariahs and for years they worked together to unravel the mystery of what had happened to their parents. But nothing made sense, and every lead they pursued hit a dead end. With time their efforts dwindled, and the five friends slowly grew apart, each going their separate ways, hoping to forget the nameless darkness that had robbed them of their parents.<br><br>Over the years, Felix proved to be an exceptional architect, though he found little inspiration working for others. He realized his father was right. His lack of social skills was holding him back. With dedication and purpose, he improved his diction and decorum and learned how to network or ‘play-act’ as he liked to call it. He created the perfect façade to make himself more likable and popular with potential clients. After working for several architectural firms, he established his firm with his colleague Lauren Golder. Both shared a similar vision and were philosophically opposed to formulaic modernist buildings, often experimenting with unusual materials, shapes and structures.<br><br>Felix continued to undermine traditional expectations in favor of the edgy and unconventional devices that set the architectural world abuzz. But even with all the accolades, he couldn’t shake the feeling that he was a phony, like an actor who had learned a part instead of a true architect who had inspired the world with an impeccable design. During these moments of insecurity and self-doubt, he would distract himself with endless parties and drown his anxieties in alcohol, wishing his father was still around for some harsh advice and tempered wisdom.<br><br>Eventually, Felix’s girlfriend announced that he was going to be a father. The news shook him to the core and, wanting to inspire his unborn child as much as his father inspired him, he quickly pulled his life together. What he needed was a project that would challenge him and cement his worth as an architect. As fate would have it, the perfect opportunity presented itself when old friends of his father commissioned his firm ‘Richter and Golder’ to build something new and unconventional on Dyer Island. The challenge excited and terrified Felix, who now drowned his anxieties with articles and books on parenting.<br><br>Within six months, the Dyer Restoration Project was underway, and as Felix surveyed the island, he suddenly heard a familiar voice calling out to him from beyond the shattered Victorian buildings and the crumbling ruins hiding dark stories long hidden and forgotten. Through a strange, gathering fog, he saw a form slowly take shape. His eyes widened, and his lips parted, but no words issued forth. Could it be? Was it possible? No... it couldn’t be... it was... impossible... and yet...<br><br>With dawning realization, Felix staggered back as he watched his father emerge from the fog. His legs felt weak, and his rising heartbeat thrashed in his ears. It was him. It was really him. His unborn child would know his grandfather, and he could finally show him how much he had accomplished since he disappeared. They stared at one another for a long moment. Then his father gave him a look of disappointment, turned his back on him, and proceeded to walk away. Over his pounding heart, Felix chased after him and was never seen again.",images/CharPortraits/Yemen/S23_charSelect_portrait.png
23,Aurora,Élodie Rakoto,Female,"An occult investigator, able to use cunning tricks and stubborn resolve to keep herself alive.<br><br>Her personal perks, <b>Appraisal</b>, <b>Deception</b>, and <b>Power Struggle</b>, allow her to interact with objects in new ways, all while having a backup plan to escape Killers.","Born into a lush Parisian household, Élodie Rakoto grew up in a comfortable home miles away from the verdant island of Madagascar, her parents' birthplace. Her backpack was always heavy and usually contained no schoolwork. She carried the essentials: a few history books, some printed maps, and a compact shovel. Instead of wasting away with regurgitated facts from her classes, she explored the city to discover the stories behind each statue, neighborhood, and street sign. She collected bits and pieces of Paris, making it her own.<br><br>When she was fourteen, her parents took her to Dyer Island for a 'business trip.' To her grand disappointment, the island was a private site for exclusive members of the Imperiatti. She was forced to attend pretentious and awkward social mixers daily. After a few weeks on the island, she met the Pariahs, like-minded teenagers who had no interest in being pawns for their parents' political chessboard. On dull, rainy nights she would convince them to sneak out and explore the island unsupervised.<br><br>One foggy evening, they stumbled upon an abandoned internment camp. Felix, one of the Pariahs, didn’t want to go in, but Élodie insisted. Inside, they found a strange underground laboratory in ruins. The Pariahs grew excited, browsing through the strange apparatuses for trophies and mementos. But Élodie noticed something in the far-left corner of the wall: odd scratches in the shape of a circle. She ran her fingernails against the cool concrete—the marks were deep and narrow. A warm whisper suddenly sent her mind adrift—<br><br>—Deep, rumbling thunder. Black, glistening waves. An ashen sanded beach. Incomplete. She was compelled to touch the ice-cold sand and draw a circle with a line in the middle.<br><br>A sharp thunderclap and lightning whipped the sky. The ground shook as sleek, obsidian claws tore through the concrete floor, ripping the earth open. The building began to collapse and Élodie spotted her mother wielding a bizarre instrument while her father told her to run. Then--<br><br>Complete darkness.<br><br>Élodie never saw her parents again.<br><br>For years, this nightmare woke her in the middle of the night, cold, sweating, shaking like a leaf. As a child she suffered from night terrors and often resisted going to bed. To soothe her mind, her grandma would light a tea candle and tell her stories until the wick extinguished in a hot pool of liquified wax. The perfume of the warm vanilla-scented wax would lull Élodie to sleep as she envisioned stories of legendary heroes defeating fear and foes. Élodie had forgotten the stories, but she still remembered her longing for the verdant Malagasy rainforests and colossal mountains that her grandmother described. When Élodie felt cold and numb with grief, she would light a vanilla-scented candle and summon her childhood memories of this distant, idyllic place, raising her spirits to rise above her crippling depression.<br><br>Fourteen years later, Élodie still searched for the missing pieces of the puzzle. No rational explanation could explain her parents' disappearance, so she had been looking elsewhere. She researched any and all legends that mentioned a dark force that snatched people at night without a trace. From there, she translated old tales and built a tapestry of narratives from around the world that corroborated the uncanny way her parents had vanished on Dyer's island. She also gathered artifacts made by ancient civilizations who sought to destroy or resurrect the incomprehensible and indescribable Thing that took her parents. There were various names for it, differing from one language to the next: The Abyss, The Infinite, The Hole.<br><br>Her findings pushed her further into the dark field of occultism. The Pariahs were long gone. She'd alienated them with her theories. But she refused to give up on her parents.<br><br>Élodie set out into the cold, misty evening. She turned a corner, leaving Paris' 13th arrondissement, an eccentric neighborhood with a substantial library dating from the middle ages. She had pressing work to do for Hazra Shah, the Collector, an occult specialist who archived rare artifacts.<br><br>He’d recruited her after she’d salvaged a rare stolen Maori statue of spidery fangs like the claws she'd seen on Dyer's island. For the next five years, Élodie had been procuring occult relics for the Collector. In exchange, he provided large sums of money, equipment, and precise information about obscure manuscripts.<br><br>Just as the Collector requested, she had secured the annals of a witch trial convicting a mother birthing conjoined twins in the 17th century. According to legend, an occult incantation was engraved on a set of skulls, all of which the Collector possessed except one—the witch's skull. There were no traces of where the skull was now, but Élodie had found a newspaper article dating back to the same year, mentioning that most remains had been relocated to the catacombs to avoid a pandemic. Élodie was acting on a hunch. Breaking into the catacombs to retrieve a lost skull involved certain risks, but no more than the previous work she'd done for the Collector.<br><br>With a flashlight, she followed the ancient layout of the catacombs and spotted a collapsed wall. A few large stones blocked the way in. She grabbed her portable XRF analyzer and scanned the materials of the wall. Working for the Collector had its perks. The brick mortar had been poorly mixed, showing high traces of sand. The whole thing was brittle, and the ground was moist from the damp evening air. This was her way in.<br><br>The journey beneath was long and treacherous. The air was heavy and moldy. She gasped when her key-chain flashlight hit an endless wall of bleached-white skulls.<br><br>Something cracked behind her. She spun around and collided headfirst with a baseball bat. Pain exploded in her skull and darkness filled her view.<br><br>When she came to, a man was carrying her over his shoulder, venturing deeper inside the catacombs. He was wearing a dark robe.<br><br>The Black Vale.<br><br>She'd managed to elude them until now. Ruthless and lethal, they went by many names. She'd figured out that they ultimately all worked for the same group, a ring of occult fanatics rumored to perform human sacrifices for what they called The Old One. She had to get out of here fast.<br><br>Élodie spotted a loose skull on the wall, grabbed it and smashed it on her assaulter's head. Stunned, the man lost his balance and Élodie hit the ground running. As she turned a corner, she suddenly felt a sharp pain to her side.<br><br>She looked down and saw a large blade planted there. Shocked, she removed the knife and warm blood spurted out.<br><br>Her heartbeat rang in her ears as her vision blurred.<br><br>She fell to her knees. Summoning all her strength, she drew a circle on the ground with a shaking, blood-red finger and traced a line in the middle.<br><br>An opaque heaviness fell over her shoulders. A familiar scent of vanilla-spiked fruits and lychee nuts coated the air. Thin, tropical rain drizzled down leafy vines. Warmth.<br><br>Madagascar.<br><br>A ghostly cry erupted from the thick foliage.<br><br>Élodie looked up and the vines turned into hissing snakes. The soft canopy soil suddenly turned ashen and collapsed under her feet. She sank into something dense and cold that swallowed her like quicksand. She screamed, before being smothered by... the abyss...the infinite... the hole...<br><br>She found what she had been searching for.",images/CharPortraits/Aurora/S24_charSelect_portrait.png
