id,dlcID,name,gender,bio,lore,image
28,Ion,Jonah Vasquez,Male,"Jonah is a mathematical mastermind, able to use logic to help his team.<br><br>His personal perks, <b>Overcome</b>, <b>Corrective Action</b>, and <b>Boon: Exponential</b> allow him to quickly flee, correct failed skill checks, and treat dying Survivors.","Jonah Vasquez saw the truth behind the veil. His gifted mind understood numbers in a way few could. Sunsets, architecture, a blade of grass—he saw more within them than eyes could gleam. He understood the language that explained them—mathematics—complex equations that continually played out around the universe to determine why and how we exist. Structures. Patterns. A law unbroken: physics.<br><br>His gift would have been overlooked had his family’s history of poverty continued for another generation. But some patterns are meant to deviate from their common course, and Jonah’s father strived to better his family with every muscle he had. What started as a job picking fruit near Fresno, California, eventually led to him owning a small mangrove. It wasn’t much, but it was enough to provide Jonah a stable childhood and education.<br><br>Though placed in advanced classes, there were few signs of Jonah’s brilliance to his peers. He was a normal boy with a few close friends, a passion for baseball, and an interest in ancient civilizations. However, when he was alone, his mind turned to numbers—and these, to Jonah, were the most fascinating of marvels. He delved into Fibonacci and Recaman’s sequences and was soon poring over complex equations from history's leading mathematicians.<br><br>On his 16th birthday, he received an unaddressed card. There was nothing within but the following numbers: <b>8, 25, 19, 44, 1; -20.37, -69.85; 13, 2, 26, 11, 1</b><br><br>It was a puzzle. Perhaps a gift from his math teacher or a relative who knew of his penchant for solving brainteasers. But somehow this was different. While he immediately recognized the GPS coordinates, quickly discovering they led to a location in Chile, the other numbers meant nothing to him. Every attempt he made led to failure.<br><br>Over time, he abandoned the puzzle, convinced it was flawed. He went on to university and, upon graduation, was hired as a codebreaker by the CIA. On his first day, written in his employee handbook, were the numbers from years ago: <b>8, 25, 19, 44, 1; -20.37, -69.85; 13, 2, 26, 11, 1</b>. A tension in the back of his neck materialized, a feeling that he was being toyed with. He returned to the puzzle, only to discover that his years of experience would reveal no new information. He couldn’t dwell on it—he had a job to do.<br><br>He was put to work deciphering messages from signal stations around Europe. Archived footage found that for twenty-three years dozens had been operating in an unknown capacity. Simple blinks of light hid complex codes that revealed disjointed information. It wasn’t much to go on, but he discovered the messages seemed to involve powerful and wealthy individuals from around the globe.<br><br>The project was abruptly shut down. All agents involved were transferred to other assignments. Jonah was moved to a covert task force in the newly formed democracy of Kwantana, where he intercepted and decoded messages from bands of rebels. His work enabled the U.S. to target numerous rebel locations. Then the bombs dropped.<br><br>It was discovered too late that the messages were decoys. Civilian casualties were staggering, the true numbers covered up by officials. Jonah blamed himself. He saw firsthand the damage done and the families torn apart. He took a leave of absence but remained in Kwantana, surveying the damage. He had to do something. He cashed in his favors with one of the CIA’s digital security experts and infiltrated the rebellion’s computer network. From there, he took stock of the numbers, and made changes he thought no one would notice. Small amounts of money were siphoned from the rebels to those who lost their homes and loved ones.<br><br>It seemed like a smooth play, undetectable and bloodless—until the day the gunshots rang through his suite. Jonah hit the floor as glass shattered and holes punched through his walls. Grabbing his laptop, he broke his kitchen window and leapt to the neighboring building’s roof. Before he could even rub his throbbing ankles, the small house exploded into flames. He ran, not looking back. He climbed down to the alley, made his way to the slums, and concealed himself among rickety shanties of cardboard and rotting wood. A week later, he arrived at an American embassy, exhausted, dust-ridden, and defeated.<br><br>Before he could take a breath, he received a call from his chief officer at the CIA: ""Was it worth it? You over this crusade of yours?""<br><br>He felt powerless. And so, he returned his focus to what was simple, what was black and white: numbers.<br><br>His chief officer gave him a new assignment, one classified to all but a few. His research on the signal stations had reached someone high up, and the project was re-opened under a veil of secrecy. Jonah dedicated his time to deciphering the codes, partly out of fascination and partly to forget the guilt that resided within him. What started with signal stations led him to something even more baffling: horror podcasts.<br><br>In the stories of campfire thrillers and slasher tales from around the world were carefully concealed codes. Sometimes numbers. Sometimes words. Each time, as if being a secret password or handshake, he found the following message: Sacrifice is rebirth. Hidden in the code was information on a network of powerful people, all working towards what, he didn’t know. There was chatter of summonings and rebirths, sacrifices and hunts. Jonah assumed much of it was red herrings attempting to mislead. Up late that night, he analyzed another code—this time concealed in a story of vampires. What he deciphered sent a chill through his spine.<b>8, 25, 19, 44, 1; -20.37, -69.85; 13, 2, 26, 11, 1</b><br><br>The numbers had returned. They haunted him. He saw them when he closed his eyes. They clung to his sleepless mind, begging for attention. He checked the coordinates as he had years ago—it was nothing but a Chilean graveyard. He logged into the CIA database and searched the history of the location. Only one hit came up: a cold case where bodies were found in the area, the corpses eaten by hundreds of crows.<br><br>Jonah couldn’t let the mystery go on any longer. The numbers had followed him all his life and he was ready to follow them. Knowing his chief officer wouldn’t approve, he booked a ticket to Chile without anyone’s knowledge. It was time to see what was so special about the coordinates. Less than 24 hours later he arrived at –20.36, -69.85. He found himself under the sweltering sun, standing in the graveyard of a ghost town.<br><br>There was nothing but dust and bones. Jonah spit into the dirt and puzzled over the numbers once more. He slumped next to an old grave, under the eyes of a watchful crow. He missed home, he missed the mangrove, he missed a time before the complexities of the universe crashed down on him. He looked out at the old derelict buildings on one side and the sweeping desert on the other. There were similarities to Fresno—the dry heat, the sunset that cast an orange glow on the dusty ground. But it wasn’t home. Not to him. He looked at it from the eyes of a man who didn’t belong in this place.<br><br>And then Jonah understood.<br><br>He was analyzing the code from his own experiences, his own view of the world. There was so much he overlooked. With feverish devotion, he considered what the numbers could signify for other cultures: ancient Egyptian measurements, Persian currencies, and... antiquated calendars. He finally understood.<br><br>He sifted through his knowledge of ancient civilizations before coming to the Tanyrian calendar. Plugging in the numbers as dates, he converted the first half of them over to the Gregorian calendar. He wasn’t prepared for the number it would reveal: his birthday. The world spiraled around him. With sweaty palms, he calculated the remaining numbers. It gave him another date: today.<br><br>The code... it was about Jonah, at this location, at this moment. His hands shook. His heart pounded against his ribs. Was he part of a prophecy or had someone led him down this path? He didn't know. For once, numbers no longer made sense.<br><br>A heavy fatigue came over him and the world shifted in impossible ways. He knew the equations behind nature, he knew what he saw couldn’t be. He witnessed his father’s mangrove beyond the desert and felt overwhelming comfort. Crows cawed in the distance and the smell of citrus wafted on the breeze. He considered that he was once more a child, and the numbers nothing but a horrible dream. Trapped in nostalgic thoughts, he didn't notice the dark fog seeping from the grass, swirling its way towards him. Crows flew from the branches, screeching relentlessly, flying in a circle above. It was too late when he realized the scent on the breeze was no longer citrus.<br><br>It was blood.",images/CharPortraits/Ion/T_S29_charSelect_portrait.png
29,Kepler,Yoichi Asakawa,Male,"Yoichi is a brilliant marine biologist and psychic whose knowledge and abilities allow him to protect himself and assist others.<br><br>His personal perks, <b>Parental Guidance</b>, <b>Empathic Connection</b>, and <b>Boon: Dark Theory</b> allow him to hide from Killers, call out to injured Survivors, and help others move faster.","As a child, Yoichi gained an interest in the supernatural from his father and mother when an inexplicable curse claimed both their lives. As an adult, Yoichi graduated with top honours in marine biology from a university in Tokyo, and, following in his father’s footsteps, became the youngest professor in the school’s history. But his career began to unravel when two of his students disappeared while doing research in Izu Oshima. The mere mention of Izu Oshima triggered painful memories from his past. Deep, hidden memories bubbled up from the murky, black depths of his subconscious. Blurred faces on images, twisted mouths, inexplicable deaths suddenly filled his mind. The shouts of people calling him a monster. And then… the monster… Sadako rose from the abyss to let him know the curse was not over. It would never be over.<br><br>With a cry, Yoichi shut his eyes and slowly released his fear. When he opened his eyes again, Sadako was gone, but something had returned. Something ominous and otherworldly. He could feel an unnerving presence near him, breathing deeply like the heaving sea. Was Sadako tormenting him? Was a spirit trying to warn him? Or was it something else? Something that consumed people. Something that made people disappear. Yoichi wasn’t sure. He had spent his life trying to understand his psychic abilities and the supernatural. His instincts told him the answers somehow lay with water. He had, after all, dedicated his life to studying intelligent life and unexplored realms within the ocean. Perhaps he needed to readjust his definition of intelligent. Or his definition of life.<br><br>Thirsting for truth, Yoichi entered a frenzy of research into the fringes of parapsychology, cryptozoology, theology, folk history. The more he expanded his field of expertise, the more he was ridiculed and ostracized. Once viewed as a brilliant young mind, Yoichi was now considered an eccentric and a liability. In mere months, the university terminated his position. Undeterred, Yoichi sought professorships at other schools, but no reputable college in Japan would take him. As a last resort he approached media outlets, and by some twist of fate, the company where his mother had worked at as a journalist offered to fund his research in exchange for articles and first publishing rights to his story.<br><br>During this difficult time, Yoichi’s father returned to him—his spirit silently goading him to continue the course he had chosen. And so, working around the clock in his tiny Tokyo apartment, he allied himself with other researchers in the paranormal field. Within months, he came across a story that mirrored the disappearances of his students: four vloggers had mysteriously disappeared near a lighthouse in Scotland. With a great sense of urgency, Yoichi took the first flight he could to Glasgow. A professor at a local university had come to many of the same conclusions as he had nearly seventy years earlier when a film crew disappeared near the very same lighthouse. There was some kind of intelligence in the water—some kind of darkness calling from the sea like an ancient siren. As Yoichi examined the research, his father suddenly appeared to let him know he was on the right path.<br><br>Guided by his father, Yoichi chartered a fishing boat and headed toward a small cluster of islands known as the Seven Hunters. Darkness fell as they approached the isles. The lighthouse, now automated and controlled remotely, sputtered and winked out of existence like a dying star. The ocean began to stir violently, lightning flashed, and the fisherman begged Yoichi to turn back, but Yoichi refused. He was too close and would not be deterred. As they argued the ocean raged and tossed the ship high and low. Then one giant wave lifted the boat as high as a house and dashed it to pieces against dark, jagged rocks.<br><br>Yoichi didn’t remember much after that. He remembered falling into the water. He remembered swimming to the landing where he saw his father standing on the gallery of the lighthouse beckoning him. He remembered staggering through thick black fog as he climbed the stairs. He remembered the water level rising with every step until the frothing mouth of the raging ocean swallowed him whole.",images/CharPortraits/Kepler/S30_charSelect_portrait.png
30,Meteor,Haddie Kaur,Female,"Haddie is a brave and determined podcaster with the ability to see and feel places of great suffering she calls Overlaps.<br><br>Her personal perks, <b>Inner Focus</b>, <b>Residual Manifest</b>, and <b>Overzealous</b> allow her to track Survivors and Killers after an attack, use Flashlights more effectively, and repair generators more efficiently.","Haddie spent her youth in a household brimming with love. Her mother, Professor Basant Kaur, moved across the world to teach agricultural science at a university in Trois-Rivières, Quebec. Her father, Rajan Singh, found remarkable success with a catering business in the small, Quebecoise town. Her house constantly swirled with the wonderful aromas of cumin, chillies, masala, cardamon and fresh, steaming naan pulled from a tandoor oven. Her earliest memories were filled with stories of India and on her tenth birthday her parents promised to visit Punjab just after the new year.<br><br>During the holiday season, her parents went to a party with their closest friends, Marise and Francois Rois. When Haddie called her parents to say she felt sick, they left in a hurry. Driving through the winding, snow-swept roads of rural Quebec, Rajan lost control of the car, skidding into an icy, gnarled forest. It would be two days before their bodies were found trapped in the vehicle. As Haddie’s fever broke, the police arrived at her doorstep telling her that they had not suffered. But Haddie was old enough know to the police were just being kind. The next morning, she woke up with white hair and a question that would haunt her for the rest of her life.<br><br>The Rois took Haddie in, doing their best to fill the hole left by her parents. Despite the enormous loss, Haddie was again surrounded with love: the love her adoptive parents had for their son, Jordan, and the love the three had for her. But the trauma of losing her parents seemed to unlock something within her. She began to see things nobody else could see; horrible, unnatural, unexplainable things. Apparitions tormented her in class, at home, in bed. Her unexpected screams earned her the nickname “Helly Haddie,” only adding to her alienation and anguish. Once a cheerful and social child, Haddie walled herself off to the world.<br><br>With time Haddie realized her uncanny abilities only triggered in certain areas—dark areas. It was as though there were places in the world where another dimension somehow bled into our own. Jordan called these intersecting areas Overlaps, and they seemed to give Haddie insight into a dark, shadowy world straight out of a cosmic horror story. When Haddie graduated from high school, she felt an unexplainable tug to discover who her parents were. To raise money for a trip to India, her brother Jordan suggested that they use her abilities to explore and document all the haunted places in Quebec, starting with a haunted asylum. At the Dorea Institute, Haddie could see and hear residual memories... patients, doctors, and so much more.<br><br>While recording her impressions at the institute, she offhandedly called the encroaching dimension the Ravage since it not only assaulted her with memories from all times and places but also gave the sense of feeding off psychic energy. The Ravage, she sensed, was a living mosaic of human suffering that was slowly corrupting and devouring the world. She concluded that they needed to investigate more to see if there was anything to her hypothesis.<br><br>Jordan presented the footage and recordings to their uncle Stefan who helped them turn what they had documented into a web series. Within days of uploading the first episode, Ravages of the Abyss was a viral hit. True crime fans, ghost-chasers, and skeptics flooded the comments with their own theories of what she was experiencing. Stefan handled the production, and before long, he presented Haddie with her first cheque as a professional podcaster.<br><br>Now with a working budget, Haddie was able to investigate the most haunted places in the world seeking answers about the Ravage. Her investigations led her to a secluded island where once an entire town had mysteriously disappeared leaving dozens of empty homes. She never felt such a strong influence of the Ravage as she did here. It pulsed with suffering and cruelty and repressed darkness.<br><br>Haddie absorbed the emotions of the ghost town and closed her eyes. Calming herself and silencing her mind, she began to hear guttural screams and cries and whimpers. When she opened her eyes again, she could see the scintillating orange residual memories of people tearing each other apart in the mud and rain. Then everything disappeared as a much older version of her stepbrother beckoned her from one of the homes. She chased after him only to stop suddenly with the realization that the Ravage was toying with her emotions, playing tricks on her, making her see things that couldn’t possibly be real.<br><br>The encounter nearly put Haddie off the project entirely, but she was now the linchpin for a company that fed her family. Her uncle Stefan continued to line up sites to visit, and after a personal trip backpacking across India, Haddie carried on subjecting herself to the horrors of the Ravage.<br><br>Then, while investigating a haunted World War II bunker in the Alps, Haddie heard someone faintly crying out for help in Punjabi. Snow flurried in the bunker as a tunnel suddenly opened to a snow-covered forest. A horn blared in the distance and faded away. She saw the glow of red lights through a wall of snow and felt her heart skip a beat as she rushed to a crumpled, blue car pinned between two massive pine trees. Through the shattered windshield she saw the bodies of her parents stuck in pools of frozen blood.<br><br>Haddie narrowed her gaze and saw tiny plumes of vapor floating from their trembling blue lips. With a profound sense of urgency, she rushed around the wreck trying her best to push, pull, and kick her way in. All to no avail. As she cried out to them that she was sorry for being sick, that the accident was all her fault, their eyes snapped open and, in unison, they answered the question that had anchored her life to their death.<br><br><i>Yes... Beti... we suffered...</i><br><br>With a terrible cry Haddie fell back into the snow as ice tendrils wrapped around her and pulled her down into a world of endless darkness.",images/CharPortraits/Meteor/S31_charSelect_portrait.png
31,Orion,Ada Wong,Female,"Ada Wong is a mysterious secret agent whose skill in espionage makes her a dangerous foe.<br><br>Her personal perks, <b>Wiretap</b>, <b>Reactive Healing</b>, and <b>Low Profile</b> allow her to spy on a Killer, gain a surge of healing when her allies are hurt, and leave no trace when she is the final Survivor.","Everything about Ada Wong was an enigma. Her history, her nationality, her allegiances, her motives, even her real name was a mystery. Was she a corporate spy working against the Umbrella Corporation? Was she loyal to Albert Wesker? Or was she a double agent? And why was she after the Las Plagas parasite? Clearly, she was a trained assassin. A weapon’s expert with advanced martial arts training. While investigating Los Illuminados, she was captured and nearly killed in a ritual sacrifice. But in the end, she escaped and was never seen again. That, too, was an enigma.",images/CharPortraits/Orion/S32_charSelect_portrait.png
32,Orion,Rebecca Chambers,Female,"Rebecca Chambers is a gifted medic and squad member whose presence soothes those around her.<br><br>Her personal perks, <b>Better Than New</b>, <b>Reassurance</b>, and <b>Hyperfocus</b> allow her to give her teammates speed boosts, give temporary relief to struggling allies, and complete skill checks at increased speed.","A child prodigy, Rebecca Chambers graduated from college at age 18. As a Rookie Police Officer, she was the youngest member of the Special Tactics and Rescue Service assigned as a field medic with Bravo Team. Dispatched by S.T.A.R.S. to the Arklay Research Facility, her squad investigated a series of grisly murders. While exploring an abandoned train, she discovered undead monsters and mutated animals. She escaped to an even more horrifying place, an old underground Umbrella Corporation facility filled with shocking abominations.<br><br>Desperate to find the other members of Bravo Team, she followed their disembodied voices into a mysterious, black fog that seemed to appear from nowhere. As Rebecca pushed through the heaving fog, she suddenly heard menacing footfalls behind her. Instinctively, she reached for her sidearm, but her holster was empty. Her weapons were gone.<br><br>As she turned, she heard a guttural roar and quickly evaded a massive club-like weapon. Clambering to her feet, she rushed toward a flickering light in the darkness.",images/CharPortraits/Orion/S33_charSelect_portrait.png
