id,dlcID,name,gender,bio,lore,image
0,,Dwight Fairfield,Male,"A nervous leader, able to locate his allies and increase their effectiveness.<br><br>His personal perks, <b>Bond</b>, <b>Prove Thyself</b> and <b>Leader</b>, allow him to get in proximity of other Survivors and provide bonuses to their actions as well as his own.","Dwight was geeky and scrawny through high school. He always wanted to be one of the cool kids, but somehow never had the charisma. He tried out for the football team but was cut, the basketball team didn’t even take a look, and his grades were distinctly below average.<br><br>One weekend, on a team building exercise from his dead-end job, Dwight’s boss led them deep into the woods before breaking out his family recipe moonshine. Dwight remembered taking the first sip before waking up late the next morning all alone.<br><br>During the night, the others had abandoned him. Once again, the laughing stock of the community Dwight tried to hike his way out of the woods. That was the last anyone ever heard of Dwight Fairfield.",images/CharPortraits/DF_charSelect_portrait.png
1,,Meg Thomas,Female,"An energetic athlete, able to outrun most Killers.<br><br>Her personal perks, <b>Quick & Quiet</b>, <b>Sprint Burst</b> and <b>Adrenaline</b>, give her advantage to escape chases and put distance between herself and the Killer.","Perhaps it was her mother that had instilled the fierce streak in her or maybe it was her father that left them when she was a baby.<br><br>Meg excelled at schoolwork but she was off the rails. Fortunately, an athletics coach encouraged her to channel her misspent energy on the track.<br><br>She motivated herself into becoming a high school star and earned a scholarship to college. When her mother fell ill, Meg decided to give up her chance at college to care for the woman who had raised her.<br><br>One summer’s day, on a long run deep in the woods, Meg vanished. Search as they did, they never found her body.",images/CharPortraits/MT_charSelect_portrait.png
2,,Claudette Morel,Female,"A studious botanist, able to boost her team's survivability as well as her own.<br><br>Her personal perks, <b>Empathy</b>, <b>Botany Knowledge</b> and <b>Self Care</b>, allow her to spot injured Survivors and heal her team and herself more effectively.","From the day that her parents gave Claudette her first science kit, she loved experiments. Her single minded pursuit lead to an early scholarship at a great college. It was a huge decision to leave Montréal, but the chance was too good to pass up.<br><br>Her introverted nature meant that chat rooms and forums were now her best source of social interaction. Her new favorite activity was to answer botany questions for others under the moniker of Science Girl.<br><br>One evening, during a long bus ride back from the city, Claudette took a stroll that would change her life. It only took a minute for her to get completely disoriented in the thick woods. She never found her way back. Her forum only started to wonder where she was a week after she stopped posting.",images/CharPortraits/CM_charSelect_portrait.png
3,,Jake Park,Male,"A solitary survivalist, able to hold his own in most situations.<br><br>His personal perks, <b>Iron Will</b>, <b>Calm Spirit</b> and <b>Saboteur</b>, allow him to more effectively move about the environment and survive while injured.","Growing up the son of a wealthy CEO was always going to put pressure on Jake Park. When his brother graduated with honors from Yale the pressure on Jake intensified. Jake just wasn't the academic type, but his father never really understood his refusal to embrace the expensive education he lavished upon him. Eventually, Jake rebelled by dropping out of school entirely.<br><br>Now, Jake lives off the grid on the edge of the woods. It’s been years since he spoke to his father but his mother checks in once in a while. It was she who eventually called the police.<br><br>The cops said he got lost in the woods and a search party looked for days, but gave up as bad weather rolled in. Despite passionate pleas from his mother, they never resumed the search and Jake went down in history as another casualty of the woods.",images/CharPortraits/JP_charSelect_portrait.png
4,,Nea Karlsson,Female,"An urban artist, able to easily escape and hide.<br><br>Her personal perks, <b>Balanced Landing</b>, <b>Urban Evasion</b> and <b>Streetwise</b>, make her well suited to completing objectives and rapid evasion.","Nea grew up in the small town of Hjo in Sweden. She had a happy childhood even though her mom and dad worked hard. As the opportunity to move to the US became a reality, she started acting out. Nea was forced to leave her friends and life behind.<br><br>Nea shied away from what her parents considered “normal”. Instead she took refuge in skate parks, and her tag “Mashtyx” was seen more or less all over her new hometown.<br><br>Nea made a sport out of tagging government buildings, avoiding the fuzz and any other danger with her nimble cat-like abilities. Finally Nea’s parents became used to her disappearing for a few days on end. She may have gone too far when her friends dared her to tag the old Crotus Prenn Asylum one moonless night, as she was never seen again.",images/CharPortraits/NK_charSelect_portrait.png
5,Halloween,Laurie Strode,Female,"A determined Survivor, prepared to weather any challenge.<br><br>Her personal perks, <b>Sole Survivor</b>, <b>Object of Obsession</b> and <b>Decisive Strike</b>, grant her powerful survival abilities at the cost of leaving her exposed.","You never know what really matters in life until you’ve realized it might end soon. Laurie is one of those who just wants a quiet life in the suburbs, hanging out with friends, family and maybe go on a date or two. Laurie is a typical teenager. You could pass her on the street and not think twice. She does her homework and is liked by her friends, teachers and family.<br><br>A simple night of babysitting turns into something that will forever change the course of her young life. A knife swooshing through the air. Screams from afar. Noises that play tricks with her mind. But not Laurie, she’s made of something stronger. Something that won’t give up.",images/CharPortraits/DLC2/LS_charSelect_portrait.png
6,Fleshandmud,Ace Visconti,Male,"A lucky gambler, improving the odds of the entire team.<br><br>His personal perks, <b>Open Handed</b>, <b>Up the Ante</b> and <b>Ace in the Hole</b>, boost the Luck of all Survivors and help with unlocking chests.","Ace Visconti is one charming guy. With his sharp Italian looks, grey-streaked hair and silver tongue, he could pass for an aging 50s movie star.<br><br>His heart has always belonged to the cards. From his roots as a poor boy in Argentina, he gamed, scammed, seduced and smooth-talked his way to a life of luxury as a high roller in the land of opportunity. Despite money always having a way of slipping through his fingers, Ace always figured he could win more.<br><br>He never fulfilled that ambition; eventually he racked up too many debts with the wrong kind of people. And when they finally came to collect, Ace was nowhere to be found. No one knew who tipped him off or where he fled to, but anyone who knew Ace Visconti can agree on one thing. He will survive: against all odds.",images/CharPortraits/DLC3/AV_charSelect_portrait.png
7,,"William ""Bill"" Overbeck",Male,"An old soldier, accustomed to dealing with critical situations.<br><br>His personal perks, <b>Left Behind</b>, <b>Borrowed Time</b> and <b>Unbreakable</b>, make him more powerful in dire moments.","It took two tours in Vietnam, a handful of medals, a knee full of shrapnel, and an honorable discharge to get William ""Bill"" Overbeck to stop fighting and try to live a peaceful life. He hated it.<br><br>After decades spent drifting aimlessly through dead end jobs, Bill went in for a routine surgery and woke up to find the world he knew was gone. A plague was turning normal people into mindless killing machines. Naturally, the first thing he did was fight his way home and put on his uniform. Making his way through rural ghost towns and pitch-black forests, he found other Survivors, and together they fled from the infected hordes.<br><br>In the end, Bill sacrificed himself to ensure their safety. His body was never found. Bill was left for dead. No one knows that he still has the only thing he ever wanted: an enemy to fight.",images/CharPortraits/L4D/BO_charSelect_portrait.png
8,Sparkofmadness,Feng Min,Female,"An objective-focused competitor who can quickly adapt her strategy to meet a vast range of challenging situations.<br><br>Her personal perks, <b>Technician</b>, <b>Lithe</b> and <b>Alert</b>, help her with repairing generators and locating the Killer.","Feng Min was a young girl when she first picked up computer games, and she was instantly hooked. Her parents saw no wrong with a few minutes in front of the screen, but as minutes turned into hours and sometimes days, they finally decided to pull the plug and force Feng Min to put more efforts into her studies.<br><br>She felt smothered by parents, so she left home and spent her time in internet cafés and LAN parties where the old rules didn’t apply. She spent hours playing, streaming, competing to rise to the top. In the gaming world, she finally found respect. Nicknamed the “Shining Lion,” she was invited to join a prestigious e-sports team where she found a sanctuary free of the misconceptions and prejudice she had felt from her parents and the non-gaming world.<br><br>Feng Min pushed her limits to prove she was the best. Sleep was less important to her than training. She pushed herself too far, slept too little, and her performance began to slip. She started to lose. At night, she would stay up, tormented by the thought of disappointing her parents… and her fans. She spiraled out of control and fell into a pattern of self-destruction. She started wandering the streets and visiting bars, waking up in places she didn’t remember. One day she woke up somewhere completely different…",images/CharPortraits/DLC4/FM_charSelect_portrait.png
9,Boreal,David King,Male,"A rugged scrapper, rewarding high-risk play.<br><br>His personal perks, <b>We're Gonna Live Forever</b>, <b>Dead Hard</b> and <b>No Mither</b>, reward an aggressive, confrontational playstyle but leave him vulnerable.","The single child of a wealthy family, David King seemed destined for greatness. While growing up in Manchester, he demonstrated serious potential in both sports and academics, and with his family connections, all doors were open to him. He could have succeeded at anything, if it weren't for his combative nature. David lived for the adrenaline rush of a good fight and would go out of his way to get into one.<br><br>His robustness and athletic abilities led him to rugby, where he could cut loose and really cause a ruckus. King excelled and gained a reputation as a promising, if somewhat reckless, rookie. His meteoric rise came to an abrupt end when he lost his temper and assaulted a referee, earning himself a lifetime ban from the league and cutting short what most people assumed was going to be a long, successful career. King was unconcerned; money was no issue, so he took it as an early retirement and focused on other fun things to do.<br><br>Free from the constraints of a career and enabled by the wealth of his family, David King spent most of his time at the pub, drinking, watching games, and getting into fights. Some might say he was wasting his life away. Not many people knew that he was an occasional ""debt collector"" or that he fought in clandestine bare-knuckle fight clubs.<br><br>When David King stopped showing up at the pub, the few friends he still had were not surprised. They figured he had finally picked a fight with someone stronger than he was. In a way, they were right.",images/CharPortraits/DLC5/DK_charSelect_portrait.png
10,Guam,Kate Denson,Female,"A&nbsp;hopeful songbird, able to&nbsp;make the most of her surroundings.<br><br>Her personal perks, <b>Dance With Me</b>, <b>Windows of Opportunity</b> and <b>Boil Over</b>,&nbsp;grant her the foresight and feistiness to escape even the most dire situations.","One of Kate Denson’s earliest memories was standing in front of her family, singing a song that she’d learned that morning at school, and watching smiles spread across their faces. Seeing how something as simple as a song could make people so happy was the moment when she knew what she wanted to do with her life.<br><br>She practised, learned the guitar as soon as she was big enough to reach over it, and was performing in front of crowds by the time she was eight years old. Her mother did everything she could to fulfil Kate’s dreams, taking her all over home state of Pennsylvania, then across the South, and even to Nashville itself.<br><br>Kate won folk music competitions and talent shows whenever she participated, but for her to win others had to lose, and that wasn’t in her nature. She only wanted an outlet, a way to touch people’s lives. To make them forget the worries of the world and just enjoy themselves, if only for a while.<br><br>With age came a new-found freedom. She bought a battered old Chevy truck and was able to travel around by herself, meeting fans and making new friends wherever she stopped. Hers wasn’t a story of rock excess though: just the road, her guitar and maybe a good bourbon to end the day.<br><br>From sun-baked festivals to dark and cosy bars, people flocked to her voice and her self-penned songs of friendship, family, love and home.<br><br>These sentiments weren’t just lip-service: she made sure to return home as often as she could, to help out in her community and entertain the local children with her tales of the wider world. She saw it as a way of giving back, of supporting others in the same way she had.<br><br>It was home where she found most of her inspiration as well. She had always loved to take long walks in the woods around her town, exploring off the beaten track, finding a quiet spot to play and write her songs. She had a favorite location she returned to time and again, a natural hollow, encircled by trees, that looked almost as if it had been blasted out of the rocks thousands of years ago.<br><br>Here she felt a strong connection to nature, and to the Earth itself. She let her mind be enveloped by the forest and it rewarded her with constant inspiration.<br><br>She picked up her guitar and played, her fingers dancing across the fretboard. The music that she made this time was unlike her usual uplifting tunes, being much more melancholy, even dark. Still, something compelled her to continue, to finish the song.<br><br>Around her, the leaves vibrated in unison with the guitar strings and the boughs of the trees lengthened, coalescing into a living form. Spider-like legs descended from the canopy above, grasping for her. Regaining her senses, she grabbed a rock and tried to beat them back, but their skin was as hard as iron and the rock simply bounced off and skittered away.<br><br>The legs coiled like tendrils around her limbs and lifted her towards the darkness overhead. Fog rolled across the clearing, obscuring both Kate and the creature of nightmares that drew her up towards itself.<br><br>When the fog cleared, there was no sign of any struggle, or of life. Just an acoustic guitar, the scratch plate engraved with flowers; as well as the initials KD, inlaid in mother of pearl.",images/CharPortraits/Guam/GS_charSelect_portrait.png
11,Sandman,Quentin Smith,Male,"A resolute dreamwalker, increasing the survivability and recovery of his team.<br><br>His personal perks, <b>Wake Up!</b>, <b>Pharmacy</b> and <b>Vigil</b>, help Survivors locate exit gates and recover more easily.","When he heard that Nancy’s mother had disappeared, Quentin Smith knew instantly that their success had been short-lived. Although their plan had seemed to work flawlessly, Freddy Krueger had beaten death yet again.<br><br>But Quentin wasn’t about to give up. It might take many attempts, but he vowed that somehow he would find a way to beat Freddy, once and for all. If he didn’t, it would only be a matter of time before Freddy would win and Nancy was lost.<br><br>Someone like Quentin never attracted attention in a library, no matter how strange the texts he requested were. He devoured all the information he could, on shared dream worlds, lucid dreaming, and the methods to control the dream space. Forcing himself to stay awake, via a steady diet of pills and energy drinks, he searched through dusty volumes, finding myths about the demons that live in dreams, trapping their victims in limbo and feeding off their terror.<br><br>He worked quickly as he knew that Freddy would soon be coming for him.<br><br>It wasn’t long before that moment arrived and Freddy began appearing in his dreams. He stayed at the periphery at first, taunting Quentin, seemingly hoping to tire him out. Using all that he had learned, Quentin was able to see flaws in the dream; cracks where escape routes could be formed. He tested this skill carefully, not wanting to show his hand, hoping that it would give him some kind of advantage that he could use to defeat Freddy.<br><br>Then, one night, he found himself in the familiar environment of Badham Preschool. Freddy had tired of the taunting and had finally decided to gut him.<br><br>Quentin ran through the school, his quick eyes scanning for something useful in the maze of rooms. He found a can of paint thinner and quickly formulated a plan.<br><br>Once the trap was set, he waited, acting as the lure to draw Freddy into the right position. And there he was, claws scraping on metal as he closed in for the kill.<br><br>Quentin allowed himself time to enjoy the surprise on Freddy’s face as the corridor ignited and then he was away, running through the building, heading for the exit that he knew existed. If he harried Freddy, weakening him and then escaping the dream to safety, surely that would defeat him over time?<br><br>Before his eyes, the cracks in the dream closed and his escape route was blocked. He was in Freddy’s secret room again, and there was nowhere to run.<br><br>As Freddy closed in, a broad grin spreading across his ruined face, Quentin was consumed by a need to see this man finally obliterated. He wished it had been him, not his father, who threw the gas can that ended Krueger’s life, that it had been him who cut Freddy’s throat. Perhaps that desire would be enough? This was a realm of the mind after all.<br><br>He let it consume him, concentrating all his thoughts on wishing Freddy gone.<br><br>His vision was obscured with roiling tendrils of fog and, when it cleared, he was somewhere else. In another dream? If so, it wasn’t his; it felt cold and unfamiliar.<br><br>A flickering drew his attention and he realized he was by a campfire, and he wasn’t alone. Other people were trapped here too, and they needed his help.",images/CharPortraits/England/QS_charSelect_portrait.png
12,Finland,Detective Tapp,Male,"An obsessed detective, able to locate and complete objectives faster.<br><br>His personal perks, <b>Tenacity</b>, <b>Detective's Hunch</b> and <b>Stake Out</b>, make him objective-focused and able to rapidly recover.","Detective David Tapp was one of the good guys. His determination to see Killers brought to justice and their victims avenged had led him through a long and respected career.<br><br>When he first saw the details of the Jigsaw case, it seemed like many others. More grisly and macabre, sure, but just another lunatic with a penchant for the over-dramatic, who would soon be behind bars.<br><br>A stroke of insight brought Tapp, and his partner Detective Stephen Sing, to an abandoned mannequin factory, where they discovered Jigsaw’s lair. They apprehended the man but he managed to escape before being unmasked, slashing Tapp’s throat as he did so.<br><br>Leaving his partner, Sing went in pursuit, but fell victim to a booby trap.<br><br>Tapp had failed to go by the book on this one occasion, entering the lair without a warrant, and it had resulted in a Detective’s death. He was discharged from the force and left with a ruined throat and crippling guilt.<br><br>He channeled that guilt into an obsession: he would find the Killer, stop the murders, vindicate himself, and avenge his friend and colleague. Following the evidence trail brought him to Dr Lawrence Gordon and he staked out the doctor’s apartment, sure that he would find some evidence of guilt.<br><br>Then he saw a stranger at Gordon’s window, and heard gunshots. Tapp confronted him and the man fled, with the pursuit leading to an industrial building.<br><br>Tapp’s age caught up with him, A fight that he would easily have won in his younger days ended with Tapp taking a bullet to the chest. Slumping to the floor, he saw only failure. He had failed his partner, and the other victims. Whoever the Killer was, Tapp had been unable to stop him. More would die and it would be his fault.<br><br>He let the rage and guilt consume him and closed his eyes for the final time. Beneath him, the concrete floor softened. He dug his fingers into the ground, feeling dirt and leaves. Where his chest had been wet with blood, the shirt was now dry and the pain had gone. His eyes opened onto a darkened sky and the jagged, searching fingers of branches.<br><br>Screams echoed through the forest and a new determination filled him. His mind was clear for the first time in months. Victims needed to be avenged, Killers thwarted. He didn’t know what this place was, but he was still a cop, and he always would be. He had a job to do.",images/CharPortraits/Finland/FS_charSelect_portrait.png
13,Haiti,Adam Francis,Male,"A resourceful teacher, able to adapt to new circumstances and develop strategies accordingly.<br><br>His personal perks, <b>Diversion</b>, <b>Deliverance</b> and <b>Autodidact</b>, help him to distract The Killer, survive desperate situations, and become more skilled as the trial continues.","Adam was born in Rollington Town in Kingston, Jamaica. His father died in a car accident when he was two, and his uncle took him in. His uncle was a strict, but fair man, who raised him to value education.<br><br>At Kingston College, Adam discovered his father’s published works, which triggered his passion for literature. His campus, however, was known for its focus on athletics. As a shy teenager with his nose stuck in books, he was the perfect prey for bullies. What he lacked in sports, he made up in grit. He learned to defend himself in the thick of it.<br><br>It’s during his years in college that he started to imagine his life elsewhere. While his close friends orbited the music industry, he followed a surer path. His grades granted him admission to higher education, and there was a demand for teachers abroad.<br><br>After graduating university, he taught extra classes to afford applying fees overseas. He had a steady diet of long commutes, grading piles, nightly lesson plans, and early classes. After a year, he managed to apply for a position abroad. His first plane ride took him to Southern Japan for a new start.<br><br>His life in Kagoshima was hectic. There was little time to do everything he took for granted back home. His Japanese was elementary at best, which slowed him down. Buying groceries took hours, long commutes had to be planned, and lesson plans relied on Japanese notions, which he had to learn.<br><br>But after a few months, he found his rhythm. He reflected on it one morning while riding the train to work. He no longer had to study the kanji characters filling the map. He knew his way. His language skills had improved, he felt connected to his students, and he’d treat himself to luxurious restaurants on weekends. He even had his first vacation planned.<br><br>Within seconds, Adam’s world was brought down to a slow motion. Rails hissed, bags came pouring down, and the floor trembled before the hit: Adam crashed forward as the train flipped upside down. He landed on a window pane as an unhinged door came flying at a passenger. He rolled over so that the door would hit him instead of the girl. He shut his eyes as he braced for impact, but nothing happened.<br><br>He squinted one eye open and he saw nothing but darkness. A heavy Fog had taken over the train. Ice seemed to flow through his body, reaching his lips first, then the tip of his fingers before spreading to his legs. Lulled by the warm hum of the dark whisper, he closed his eyes, drifting.<br><br>No one truly knows what happened to Adam Francis. The school teachers imagined the worst when they watched the train derailment on the news and saw he was missing. Their fears seemed to be confirmed when Adam’s bag was recovered from the crash site, but his body was never found. To this day, his uncle believes that Adam took off after the train crash, alive still, somewhere out there.",images/CharPortraits/Haiti/AF_charSelect_portrait.png
